subreddit,title,selftext
vegan,Biggest changes in my body since going vegan (5 yrs),"I'm going on 5 years vegan and I have noticed changes in my body. The most noticeable changes for me are:

1. Better blood flow: No more cold feet in bed. Boners lol.

2. Pooping is way better:

Before vegan - I poop once per week. It takes 20-40 mins. My body does not want to poop away from home.

After vegan - I poop daily. It takes 1-5 mins. My body doesn't care about when or where I poop.


Call me crazy, but I think switching to veganism made my body switch from hunter mode (be paranoid about pooping to not alert prey) to gatherer mode (poop anywhere who cares lmao)."
vegan,This is going to get hate but...,"Many of the people on this subreddit are psycho.  


A turning point for me was seeing a post the other day of someone speaking about how when any person dies it can be celebrated as a good day for the animals given the person was not vegan. Even more disappointing was seeing much of the comment section more or less agreeing with this sentiment. 

A lot of you in this subreddit say something along the lines of... if someone has been informed on the atrocities of the meat/animal product industry, they have a moral obligation to be vegan or else they are a shit person you do not want to be associated with. That's just not how it works. For example, let's picture person of interest (POI) who works 2 jobs to barely scrape by in supporting an entire family, and is living in poverty. Now, don't come at me talking about how vegan diets when done correctly are actually much *cheaper*; I am aware of that, thank you. Anyway, POI has a LOT on their plate. Let's assume that includes juggling two full-time jobs and raising children who are often looked after by grandparent(s), who is/are also supported by POI. POI is going from one lengthy shift to another at Job #2 and has some time between to eat lunch, and the only easy, quick, and financially feasible option they can think of is to get a hamburger from McDonald's... I'm not going to shame that person EVER. You need to stop making the kinds of generalizations that you do. 

Also, I'll say that many of y'all don't actually seem to care about the animals as much as being morally superior and holier than thou. This is shown by the fact you don't see how BACKWARDS it is to criticize a company that produces plant-based foods for marketing the idea that there is no problem with their consumers also enjoying meat at other times. You people are not dumb; you understand that non-vegan consumers who get a hold of your criticisms are going to be pissed off and think: ""f\*ck it, I'm not trying ANYTHING from Alpha foods because these vegans are annoying asl and find something wrong with everything."" That's more meat eaten by that person, and the encouragement of more animals suffering as a result. You all need a reality check and to take several seats. It is honestly very embarrassing. This subreddit really does give the energy of WHITE LIBERALS IN VERMONT who preach all of the leftist *ideals* but love/ realistically wouldn't give up their lives of racial and socioeconomic homogeneity. UGH."
vegan,Silk tastes weird now,"I finally switched from vegetarian to vegan last June. I've had a few weak moments, eating eggs from neighbours' chickens a couple times, but otherwise I've done well my first year.

What's really helped is Silk, because I was a big milk drinker most of my life. The problem is I'm also very sensitive to taste, maybe a super taster, so I had to wane myself off gradually and I spent a few months before last June drinking Silk mixed with regular milk. Anyway I've been doing good, and I especially like the new Nextmilk. But I fear something terrible has happened.

The last 2 half gallons of each Nextmilk and unsweetened Silk I've had have been terrible. The regular Silk still tastes milky but it also tastes like leaves, like I can taste individual plant components. And the Nextmilk tastes like I'm drinking milk out of a horse's feeding trough, just an overwhelming oat and hay flavour.

Anyone else experienced this? Could it be a batch problem?"
vegan,Spider Infestation. Any Ideas?,"So I think my house has a spider infestation. I saw four of the same type of spider in my house this week alone, plus about one or two random spider appearances in between. How can I deal with this situation in a way that benefits both us and the spiders? My mom and I think they're coming from our attic if that info is needed."
vegan,Vegan Meal Plan - Meals On Me," Whether you just want to try the vegan diet or want to simplify your routine, this easy vegan meal plan has something for everyone. You will find very simple vegan recipes with simple steps and a short list of ingredients. We focus on [**Vegan Meal Plan**](https://hellomealsonme.com/) ingredients like beans, nuts and quinoa, while also limiting processed meat substitutes to keep things healthy and delicious. 

&amp;#x200B;

https://preview.redd.it/vwj8jfr2f8391.jpg?width=1080&amp;format=pjpg&amp;auto=webp&amp;s=c5a81d49e7ecd28141511089565c382f06f5f29e"
vegan,stop calling honey vegan,"I'm in the middle of a ""debate"" with a local ""vegan"" chef that just disclosed a recipe made with honey. I told them I would be just as upset to find there was honey in my vegan food as I would flesh. They said...ahhh...the great debate. It's NOT a debate! Honey is an animal product. I know we all come to things in our own time. I ate honey longer than any other animal product. But I knew I needed to adjust. I just wasn't there yet. I think we need to stop trying to make excuses for our own ignorance and shortcomings. It's ok to be imperfect...to still be learning and growing. ..but serving honey to vegans in a restaurant is not ok and not part of a ""great debate"". ...rant over"
vegan,I’m so sick.,I’m not sure if this is the right sub to be posting in but I just ate a beef burger. It’s the first time I have eaten meat in the last 5 years I’m so Ill I keep throwing up and my stomach just feels like crap. I don’t know if I came down with something conveniently at the same time I ate meat or it is the meat. So have any of you experienced the same thing?
vegan,assistance please,"I have been transitioning to vegan for a the past few months. For the last 5 or 6 months everything I eat at home is vegan but I have found it hard to be vegan out of the house when eating at my girlfriends families house or when friends order pizza on game night.

I live in England where its currently a big Bank Holiday for the Queen. One of my friends is having a BBQ and I wanna take what, for me, is a big step. I wanna take vegan food for the BBQ. I have talked about veganism with friends but I think they probably think its a phase, this might be a bit of a shock for them. 

Is there a tried and tested way to go about this? Also I don't mind my vegan stuff touching meat stuff and I don't understand why thats an issue so if someone could enlighten me on that opic I'd appreciate it.

Thanks All, keep up the good work!"
vegan,Whats the point of drinking Oat or Almond Milk if it doesnt have calcium or protein?,"I see these alternative milks everywhere nowadays like rice, oat, and almond milk.  But when i check the label on these, there's almost no real nutritional value.  People drink cow or goat milk for mainly calcium and protein benefits.

But whats the point of drinking these? Maybe im missing something"
vegan,Alternate protein sources,"Hi! so I'm vegetarian, and not completely vegan in the sense that i consume dairy and its various forms. but the question is, how do I switch from dairy to other sources of complete proteins? i mean, in India, we have limited choices, in the form of:  Paneer(cottage cheese) , soya granules/chunks, other cheeses, légumes, etc. but none of these are balanced forms, ie, they have a lot of fat, or carbohydrates in proportion to protein. Also, we don't have readily available Tempeh, or Seitan. so, what can i do to substitute dairy for a cost efficient source of protein?"
vegan,Annoying non vegan food pics,"So I'm dating this guy. It causal at this moment. He is not a vegan. I am vegan and he knows it. I find it really annoying when he sends me pictures of his food. Its also pretty annoying to me when he talks about his non-vegan foods. Like I really don't want to hear about bacon, beef, and cheese things. In my head I just think those were all living animals. How am I supposed to respond? That I think it looks good? No cuz it actually disgusts me.

He doesn't mind trying vegan restaurants. He's very open to trying vegan food.

This is really the only thing I am peeved about non vegans. I don't mind if I go to a restaurant and friend orders a non vegan food item. But I do find it polite when they don't out of respect.

When some of my friends post their non vegan food I sometimes joke that their food is unhealthy. But they know me very well and they don't take it the wrong way.

I'm usually very vocal about my dislikes in dating. But I feel like I may come of rude. None of my other dates were that interested in food so it was never a big deal I suppose. But this is just different.

Anyone else have the same problem? Am I too nitpicky? Lol"
vegan,Should I be angry?,"I got to look at the menu for my senior prom that is in a few weeks, these are some things on the entree menu: roasted chicken, pasta alla vodka, sliders and hotdogs. (Who has sliders and hotdogs at a prom or any formal event?) So I brought this up with my class advisor. I told them I am vegan and will not eat any of this. They said they would email someone from the venue to let them know and see what options I have. My advisor got back to me with what the venue said and they said “Our vegan options are salad and roasted vegetables” 

What is this? Do people really think we only eat vegetables? I don’t want to sound ungrateful because I very grateful to go to prom and be with my friends after all this covid stuff. I just don’t know if I should feel angry or just eat my lettuce and shut up"
vegan,What's your stance on GMOs?,"I'm genuinely curious to know what other vegans think about genetic modification, since I've noticed a lot of commercial vegan snacks make sure to have ""non-gmo"" in their labels.

[View Poll](https://www.reddit.com/poll/v30hd9)"
vegan,vegan alternatives for everyday products (that last),"Hi!

I've been vegan for a few years now and try to not limit it to food. However, I have trouble finding good boots and/or business appropriate shoes and bags that actually last despite daily use AND are as eco friendly as possible.

I don't mind spending more money. I just need to find something that is dress code appropriate and lasts. I can't seem to find both. Either it's dress code appropriate but plastic, or it's not fitting the dress code because it, frankly, looks too bohemian (I work a suit and tie job).

Does anyone have any recommendations? I'm spending so much time reading reviews but none seem to fit.

Oh, and I am a woman, but don't mind unisex clothing.

Thanks!"
vegan,For anyone in Adelaide Australia,"Went to the Golden Wattle on Pirie Street for a business meeting yesterday and they had a few vegan dishes. Tried the vegan burger and it was outstanding- flame grilled tofu, so much flavour and under $20 with chips. Compared to the $24 vegan burger I got at another pub recently which wasn’t much bigger than a slider. They also had salt and pepper tofu and some other dishes. Would recommend."
vegan,I wish more people atleast knew the reason for veganism,"Sure, of course I wish more people were vegan. More importantly I wish it was general knowledge of what the impact of not being vegan is. I wish everyone knew the basics. Sort of like all the things Ed talks about in his “Arguments against veganism” Ted Talk. 
That more people knew the impact on the animals lives it has and that there wasn’t such a big dissonance from associating meat with a living being."
vegan,Sweet Earth has to be the blandest vegan food I've ever had. And it's owned by Nestle. Just a reminder to ignore it.,"Over the years I've tried multiple meals from them, and they always taste like rubber.   
I just don't understand how there can be so many ingredients, whether it's in their bowls, burritos, or whatever it may be.  
They make them lifeless and taste like rubber.  
It's almost impressive.  


I haven't had them in a long time, and I just found myself with some of their seitan, and they managed to make it taste like cardboard. I just don't get it, how do you mess up food that much?"
vegan,Veggie Heaven in Denville NJ: Seeking Recipe Help!,"This place is right by where a friend of mine lives and I go there all the time. There is one item on the menu that is my absolute favorite food, and I am dying to know how to make it - the spare ribs. I make a lot of seitan stuff, and I know from asking the staff that it is made of seitan, but I still have no idea how to do it. 

In the off chance that any knows this restaurant, does anyone know how to make those appetizer spare ribs? Picture: [https://imgur.com/a/6OWOWio](https://imgur.com/a/6OWOWio)

Thanks!"
vegan,"[17F] I want to go vegan for the environment, the animals, and my health. Help make me a grocery list.","I have been vegetarian for a few years now and I don’t regret it. But my cholesterol is high and I’m a tad over weight. I originally went vegetarian because of the animals and I hate steak/any meat. I think I would truly benefit from a vegan lifestyle.. I need help though.. I want to go to the store in an hour or so and start making these changes asap. I was wondering if this sub could give me advice/help with a shopping list. I love tofu, but don’t know how to make it as good as it is at restaurants. I need good tofu recipes. I also just want to have vegan alternatives around my house for snack and sweets. I’m a snacker and I love sweets. I want to cut sugar out of my diet though because I am starting to face health issues regarding the sugar I eat everyday. Sorry for making this so long, but perhaps someone here could help me decide what to get from the store/ easy recipes ti support my new eating choices. Thank you!"
vegan,A reminder of why the term Plant-Based exists.,"Today I was eating a chickpea-tempeh salad that I threw together for lunch and the local bloodmobile was nearby, so I took it in with me, hoping to squeeze in the donation during my break.

The phlebotomist noticed my lunch and said that she had previously been on a raw vegan diet herself for a whole year and was hoping to get back into it. Encouraged to see someone else positive on the idea of veganism, I encouraged her and shared some of my own tricks for food.

She mentioned that she'd also been running around a lake each morning, but there was always a bad stench from all the ducks. The other phlebotomist jumped in and we were talking about how there's an excess of ducks in the area, and then the previously 'vegan' phlebotomist utterly shocked me.

She said she had intentionally hit one of the ducks with her car and couldn't believe that a stranger got mad, took a picture of her license plate, and even put a jacket over the duck's body. 
""It's just a dumb duck."" Was her follow-up.

I was still trying to process how she could be so uncaring, but the other phlebotomist carried on with the conversation like it was no big deal. Next she mentioned how she's not going to bother waiting for animals to cross and the other saying it's better to hit them than to swerve.

This is the sort of difference that exists between people who are plant based, and those who are vegan. People that don't care about animals, but eat plants for environmental or health reasons are still perfectly capable of treating animal lives as practically worthless. This lady decided that the duck's life wasn't even worth the minute it would take just to let it cross the road."
vegan,Are pens made from feathers vegan?," So I have a question

I found a goose's flight feather on the ground and took it home, of course there is no suffering involved for them to shed their flight feathers this time of year. If I were to use it to build a pen, would it be Vegan/ethical or is that still a no-no?

Feel free to discuss, I'm unsure about it."
vegan,An Unnecessary Interjection....,"I work in a grocery store and I noticed a customer was buying a lot of plant based products and I started talking to them about recipes and products. The woman in line behind was looking at us annoyed and all of a sudden interjected ""Why don't you both just go out and gnaw on some grass?"" All dripping with sarcasm.... I then had to ring up her order which was almost entirely steak and ribs and bacon and cheese and chicken.... I barely talked to her and I'm normally a very chatty person, but that was rude and unnecessary..."
vegan,"CULTURE is not a valid excuse for cruelty, culture and tradition are not the same as ethics and morals","The governor of Nuevo León feels this  [Nuevo León: Bullfighting and cockfighting are cruelty, not culture | PETA Latino](https://www.petalatino.com/blog/gobernador-de-nuevo-leon-en-contra-de-las-corridas-de-toros-y-peleas-de-gallos/?utm_source=PETA%20Latino::Facebook&amp;utm_medium=Social&amp;utm_campaign=0531::ent::PETA%20Latino::Facebook::Nuevo%20Leon%20pelea%20de%20gallo%20y%20corrida%20de%20toros::::link)  


Sacrificing people was tradition  
Slavery was apart of the culture and still is in some parts  


If your tradition or culture causes harm to others, its unacceptable and you are evil for participating and or defending it"
vegan,Question about the steamed veggies from the Chinese takeout restaurants in the US.,"I don’t eat out often and if I do it’s at vegan restaurants most of the time. However, on very rare occasions there was not much choice so I’ve ordered steamed veggies with plain rice (sometimes with plain steamed tofu added) from those most basic Chinese takeaway restaurants - it’s usually called “Steamed mixed vegetables”. A number of times I thought the veggies tasted a bit funny, as if they had meat broth poured over them or something. I’ve asked at multiple restaurants if they put any broth or butter etc but they all claimed it’s just veggies. Usually at those places there’s no one who speaks English well so I’m not sure how much I trust that claim when it’s hard to have my question understood. So my question to the vegan folks in the US is this - is the Steamed Mixed Vegetables dish at the Chinese takeout places vegan? Has anyone worked at these places or has more insight and can confirm? Also, are there any other dishes that are vegan or can ve veganized at those places?"
vegan,I live in a country where the public torture and murder of an animal is labelled as culture and praised by authorities,"I live in Spain.
To me, it's incredibly disgusting that the king (yeah, something from the middle ages we haven't get rid of... Yet) is used to attend that public massacre, where bullfighters are called 'masters', where followers of this culture of death chant ""vivan los toros"" (""long life to the bulls"") and where a huge chunk of the attendants are devout Catholics (where is the fifth commandant?).

Oh, and there a small chapel in every bull ring where the bullfighter prays and asks the saints to protect him.

Luckily it's popularity dwindles every year, but everything that surrounds this ""national fest"" is incredibly hypocritical that I cannot stand with it. And I have to close my mouth, lest I'm called disrispectful."
vegan,Any Services/Tools to Find Vegan Roommates?,"Hey all,  


I'm a recent (\~4 months) vegan in the Los Angeles, CA area, and I'm going to need to move soon. I'm looking to room with a vegan (ideally), for the obvious reasons (not wanting to see corpses in the fridge, smell corpses, receive annoying questions, etc.). Does anyone know of any tools or platforms to help find a vegan roommate? Obviously I'm also sort of inquiring in here if any fellow vegans here are looking for a roommate.  


Not sure if this is relevant/the right tag, first post here."
vegan,What non-vegan foods do you think could be replaced with vegan versions and most people wouldn't notice?,"I'll start.

*Most baked goods and sweets. Cookies, cakes, donuts, muffins, bagels, croissants etc. I think even some vegan ice creams could really fool most folks nowadays.    

*Protein powders. At least from a taste perspective, they taste exactly the same as non-vegan protein powders. 

*Some vegan chicken nuggets and vegan fried chicken. I've tasted a few brands now where I have to double check the ingredients because the texture is so similar to what I remember chicken being. 

*Vegan hot dogs. I think this is one of the first foods that vegans/vegetarians really nailed. 

*Vegan mayonnaise. I doubt many would notice this one. 

*Some vegan eggs. Especially the ones that are made into a patty. I honestly think most couldn't tell the difference."
vegan,"I’m allergic to soy, what now? Any tips?","I am a vegetarian my whole life, Vegan and macrobiotic most of my life. Now being vegan again for around 3 years, I’m also beginning with exercise and need my protein. 

For 2.5 years I ate soy yoghurt from Alpro every morning, but I’m allergic. My face gets tingly and itchy from raw soy (So no soy milk) and processed soy (yoghurt, tofu, tempeh) causes stomach-aches and Im done with it. 

What is a easy breakfast, protein-rich for vegans (otherwise I need to go back to organic-dairy, but the thought of it makes me nauseous) 
Thank you"
vegan,"The tale of the banana cookies, and how I’ve trapped myself","Oh, r/vegan - have you ever been there - someone makes a vegan dish just for you, only it contains an ingredient you just don’t like, so you eat it anyway? 

Well, here’s my story.

Last fall, my bf and I went to a party for a religious holiday - not a major holiday but a nice reason to get together and celebrate. A mutual friend, H, was there. Neither bf nor myself are very close to H, but we both enjoy his company and he’s always been one to make sure everyone feels included. 

H brought some cookies to the party, which everyone raved about. He asked if I wanted to try, and I politely declined and explained that I was vegan. He apologized that I couldn’t enjoy, and said he’d make something vegan next time.

A month later, there is another party, and H came up to me a few minutes after my bf and I arrived to tell me he’d made two batches of cookies this time: one vegan, one “regular.” I thanked him and told him how much I appreciated it. He told me it was pretty easy to swap out the eggs - he just used mashed banana.

I panicked inside for a second - I haaaate bananas. Like, in any form. I just cannot choke down anything with bananas, even if there’s just a small portion. 

I smiled and said I was so excited to try one. And so a few minutes later, I did. And... look, if you liked bananas or even felt neutral about them, you would love these cookies. But I just could not get past the taste. 

That being said, I wanted to show H how much I appreciated that he made vegan cookies so I could try them, so I told him I loved the cookie.

A few months pass, and this weekend bf and I threw a party for MDW. We invited H, and when he arrived, he handed us a tupperware full of the cookies - since he remembered I loved them so much last time! He then proceeded to tell the group that it’s his grandma’s recipe and how happy he is to be able to share it with friends.

Well, I think I’m a little bit trapped now. I do not like bananas, I probably never will, but I also value my friendship with H and if that means eating a cookie I don’t like that he’s so proud to share every couple of months- that’s okay. I’ll eat the cookie. 

I’m sure I’m not the only one who has eaten a vegan dish with an ingredient they don’t like, because someone made it special just for them. I’d love to hear your stories."
