subreddit,title,selftext
vegan,I hate humans and I want to be vegan," I really want to stop being complacent and ignoring the fact that I'm constantly going against what I think is right ( Ex. Eating tortured animals and their products, food that has been processed beyond recognition in pollutive factories and produce that has been shipped across the world and farmed essentially by slaves). I have no idea where to start and I'm super intimidated by the idea of really taking responsibility to do the right thing. I'm lazy and I know if I take on too much at once, I'll abandon ship and go back to trying not to think about the bad I'm doing. 

Any tips on how to get started and stay on track? I wish I could just photosynthesize."
vegan,Hypothyroidism and plant-based diet-your thoughts?,"Hypothyroidism and plant-based diet-your thoughts?  
 Does anyone suffer with Hypothyroidism? Do you feel your plant-based diet can help with this?  
I'd love to hear other people's thoughts because I recently got diagnosed!  I came across this video and wondering if there's a link  
[https://www.youtube.com/watch?v=mpfxbVPUAYI](https://www.youtube.com/watch?v=mpfxbVPUAYI)"
vegan,gardein Buffalo wings,"I bought myself some of the gardein Buffalo wings as a splurge. And holy moly these things are ridiculously spicy!!!! I can handle a lot of spice, I love spicy food and growing up my dad was way too generous with spicing food. but this has my tongue completely numb after just a few bites. They taste great but I'm practically about to be sick from how horribly spicy these are. Has anyone else tried these and thought the same?? Like I said I don't feel like I'm being weak here, these are just way too hot to eat."
vegan,The vegan movement as a problem,"As the largest community of vegans on the internet we need to make sure that we are advocating for veganism as affectively as possible, and I think discourse in this movement as a whole needs improvement.

I see many people in this sub are quite frustrated and angry at people who still eat meat and while these feelings are 100% valid it's important to remember that affective vegan advocacy comes from a place of empathy and understanding. We can't let these negative feelings transate into how we communicate this ideology to people. 

This disgust at how animals are treated on farms can make people feel judged or shamed for supporting it. As soon as people feel judged their defence mechanism will kick in and we will loose them.

We need to remember the perspective of someone who eats meat in order to successfully advocate for the vegan lifestyle. What we are advocating for is not just a dietary change but a complete change in how humans relate to other animals and nature on this planet. It cant be understated how much of a colossal change in perspective this is and it's unlikely anyone will go vegan from a single conversation.

Someone coming out of conversation thinking veganism is more reasonable than before is still a massive win for this movement! For many people their perspective on animals has never been challenged, what we should be aiming for is to plant the seed. The two most important tools at our disposal are the Socratic method (asking questions so they investigate their own perspective) and positive encouragement/reinforcement.

It's only a matter of time before animal agriculture as we know it is abolished and the better we get at advocating this change, the more animals will be spared!"
vegan,Making oat/rice milk at home doesn’t seem to work,"Hello everyone, recently I started to try making vegan milk at home, but the result is always not enjoyable in taste or either texture. It’s dense and lacks taste. What can I do? I used the methods of blending and filtering I found in YouTube videos. 
(I have accessibility to buy it in stores btw, I just enjoy cooking)"
vegan,Had to put an animal out of its misery and it’s really bothering me,"A few hours ago I heard screeching in my back yard only to step out and see my dog had mortally injured a rabbit. She wasn’t planning on killing it, she just kept picking it up and dropping it/ gently shaking it.

I called my dog inside and unfortunately the rabbit seemed to be paralyzed from the neck down. It was lying on its side breathing rapidly, writhing its head around, and its little eye looked terrified.

I contemplated what to do for a couple minutes hoping that it would pass on, but it seemed that the rabbit would slowly die in agony for at least a few hours. 

I decided I would have to put it out of its misery, so I grabbed a fluffy towel and placed it over the rabbit. I found a large rock and crushed it’s head. It died instantly and I dug a grave for it and placed some rocks over the grave so my dogs wouldn’t dig it up.

I feel like I did the right thing by ending its suffering, but it’s bothering me so much. I think the brutality of the situation is what’s upsetting me. If I could’ve just snapped my fingers and ended it’s suffering I don’t think I’d feel as awful. 

I’m not sure if this post is appropriate on the sub but I couldn’t think of anywhere else to put it. I’ve been considering veganism for a few months, this may be the deciding factor."
vegan,"How to dispute the claim of, ""oh I buy the good organic stuff, not from those horrible factory farms.""","I encounter a lot of people that think the meat/eggs/dairy that they buy is from some ethical magical farm that isn't so bad to the animals. They buy organic and cage-free and think that's enough and play dumb about what is actually happening to the animals they consume.

How do you dispute it? Is there a way to look up all the meat supplies for Kroger for example? Most non-vegans I know have no moral obligation to killing animals for food, but do not like them to suffer abuse while they're alive or during slaughter."
vegan,Need Advice,"Okay, so I feel stupid for posting this here...but oh well. I need advice on multiple issues. 

Two months ago my partner and I broke up, since then I can't fucking eat. Today I ate two packets of oatmeal and that's it. Before we split I cooked all the time. I loved looking up recipes and trying new meals that took me 1-2 hours to make, and they were always amazing. We went to the grocery store together and picked out stuff together and I would be 'head chef' most of the time and they would be my partner. Since we split I can't bring myself to cook anything. I even cried in the grocery store one time bc it was something we always did together. I have no appetite and don't even want to eat packaged vegan foods. Plus, packaged food is stupid expensive. What are some cheap, nutrient dense, and calorie dense vegan foods that I can sustain myself on?

Secondly, I don't feel like I will be able to date someone again with my moral views. My ex was my first love and we shared the same views. We both started dating as omnis but after a few months went vegetarian ---&gt; vegan together. I'm not trying to brag, but I am a pretty attractive guy that gets attention whenever I go out. However, I don't live in a place where there are that many other vegans and I definitely would not want to go on dates with an omni. I don't even really want to go on dates bc I still love my ex and don't really want to be with anyone else...but I guess going on a date would help me to move forward. I don't even know how to find any other vegans.

Third, I'm lonely in my vegan point of view. I don't know anyone else, besides me and my ex that is vegan, and that is very disheartening."
vegan,Vegan level unlocked: eat so much nooch your pee is neon yellow,"I sometimes noticed my pee was neon yellow. I thought for so long that it was because I just wasn't drinking enough water, but even with a gallon (4.5L for you people in civilized countries) a day minimum it was still happening.

Then I finally realized that it only happened on the days when I'm going to town on some nooch. Not the ""I'll sprinkle some on my salad"" days -- the ""I better bring this container with me to snack on while I watch this show"" days. A little internet searching and I see it's something about vitamins or whatever.

Anyway, I just wanted to *Bragg* (heh heh) about it."
vegan,Is it vegan to order vegan food from a restaurant that often messes up and serves animal products?,"How do you guys feel about ordering vegan food from a restaurant that tends to make mistakes and give non-vegan food (such as adding sour cream or cheese to food).

Would going to this place be vegan because you ordered vegan food, or would it be non-vegan because there's a decent chance they'll give you non-vegan food?

If they give you non-vegan food it makes sense to just eat it instead of waste it, right?"
vegan,Would you eat lab-grown meat/fish?,"I’m sorry if this is rude, but I’m honestly curious how vegans would feel about this? Science has come out in recent years with news of successfully growing meat in labs. Would you eat that, since no no animal was killed in the making? 

I’m becoming a vegan for health reasons primarily, so I probably wouldn’t eat it. I went vegan for a few months and my high cholesterol became normal, so I’m going vegan permanently because I don’t want to need a pill for that. I’m also going vegan for environmental and moral reasons, but the health benefits are the primary reason.

Again, sorry if this question is unwelcome here."
vegan,I'm just so angry,"So I'm 15 and have been vegan for about a year now and the rage I am experiencing on a daily basis is getting pretty ridiculous. I know the anger is justified but I really don't know how I can help to release just a bit of that rage. I'm not allowed to do any kind of activism other than try to politely tell my family that their attitudes towards non-human animals are wrong. It only makes me more furious that since I live in a very farming-heavy rural area of England, when I go to school I'm just sitting next to a load of animal abusing scumbags laughing about the death of the individuals they shot in the head last weekend. Is there anything I can do? Anything I have tried to do at home just ends up amounting to nothing whether it's talking to family or talking to people on the Internet who are just coming up with ideotic justifications for the shit they do every day."
vegan,Mom messed up her back this weekend so I got to make the whole family a vegan meal!,"They loved it! Rice and veggie curry with homemade samosa’s. 

I was so surprised everyone enjoyed it, I took a risk making Indian food (they’re pallets are very american pub and italian centric), but i thought it would be a good route since it doesn’t require a ton of substitutions and comes together very quickly. feeling good today, hopefully this leads to me being able to make more vegan dishes for our family in the future."
vegan,vegan meals that are high calorie and can be eaten fast,"I hate eating food in general.i consider it to be time consuming and unenjoyable past the first few bites. I would rather be doing something else. vegan meals are typically a lot higher in volume to eat and therefore more time. I want meals that can be eaten in less than 10 minutes and around 1000 calories. A good meal for me is peanut butter on whole wheat bread with applesauce, but I know that's lacking in vitamin c(etc).i also enjoy cashews and bananas together. It's a pretty quick meal, but I find most bananas to low quality to enjoy raw and cashews sometimes pricey.i like oats for a working out food but 2 cups of oats for enough calories plus liquid to inflate them is time consuming to eat. Any high calorie protien bars I can make homemade or something else?i heard hummus wraps were fast to eat.any ideas."
vegan,Cadets and Rations,"I’m an army cadet and I really want to have ration packs but I’ve been told they don’t do vegan options. Any idea where I can buy vegan ration packs or would you say since there’s not another option then I should have the vegetarian ones.

You can bring your own food but it’s incredibly hard to make your own ration packs with the right about of nutrients even without being vegan."
vegan,I am sad and beyond disgusted...,"TW: Mentions of animal abuse and curse words

Oh my goodness. I couldn't even finish the documentary, ""Dominion"" because of how brutal and horrific the animals are treated. I paused at the pig section and was just about in tears because of how miserable those mother pigs are and on top of that, have to watch as most of their babies die. Oh, and what about the runts or ""useless"" pigs? Yeah, farmers just whack them on the fucking ground to murder them! What in God's name possesses those people to obtain those jobs? I get not having a choice where you work, or if you're an immigrant coming to the US and are in need of a job, but why, WHY would you take that job of all the other jobs out there! Even if you feel like you don't have a choice, YOU DO! 

God, those poor animals. I don't think I will continue to watch the documentary because the 10 minutes I did watch were enough to convince me that I will never eat meat, dairy, etc.. again! Fuck the dairy farms, fuck the pig farms, and fuck every other farm or industry that inflicts this torture on innocent beings... Sorry for my language, I am just so sad and devastated. I knew it was bad, but I didn't know it was THAT MF bad! I wish that I could go in and grab every single one of those pigs and take them home so I can let them roam free, eat a proper diet, drink enough water, care for their young, and most importantly so that I can love them. I want those animals to know that they are loved and cared for. 

I don't know exactly what I was gonna do with this post, but I just needed to rant, and I needed to let other people who are wondering if they should go/stay vegan that they 110% SHOULD go vegan. If we keep supporting these industries, the abuse will never stop. From this moment forward, I will never eat, drink, or consume a single animal byproduct. 

If anyone has any tips or bits of information they want to add, please do so. That documentary traumatized me so much... all I can say is I am sorry. I am sorry to the animals/products I have previously consumed, I am sorry to this community, and I a sorry to myself. For not recognizing/doing something sooner. Thank you for letting me post and for reading through this."
vegan,Vegans who feed their cats meat: Do you also give your kitties meat-based treats ?,"

[View Poll](https://www.reddit.com/poll/vm1zku)"
vegan,Vegan parents- help!,"I feel like an idiot for not looking at the ingredients, but Destin is very much not vegan and has talc which scares the crap out of me. It has cod liver oil and lanolin as well. Does anyone have suggestions of vegan diaper rash brands? Destin has been a life saver with these diaper rashes so I need something equally effective. Thank you!"
vegan,"I hate when people think they'll get respect from me because they ""were vegan for a few years""","I have no clue why, but I when I tell people I'm vegan, one of the most common things I get is that they were vegan a few years ago and aren't anymore, but they tell me this like it's an accomplishment. Like I'm supposed to be impressed by that? ""Congratulations on being weak and fake?"" I have no clue what they hope my response will be to that. To me it's like telling me that you can't commit to something that doesn't directly benefit you. I don't know if they expect praise or understanding because I won't give either."
vegan,Thoughts on the Sustainability of Animal Product Clothes?,"I recently watched a YouTuber called Bernadette Banner who wears a lot of historic-type clothes.  She did a video awhile ago about sustainability of fashion and brought up animal product clothes.  I was curious about the thoughts of others in the vegan community.

https://youtu.be/6HXhW6nTCuo is the video in question and she starts on this topic at about 11:25 into the video."
vegan,what brand of Korean skincare do you recommend,I have normal skin with large pores and blackheads i sometimes get pimples (more like spots mostly on chest and shoulders) but what brands do you recommend im looking for longer routine  korean inspired type i preferably would like these products to be from ulta or sephora but if not I don't want it to be from outside of the usa
vegan,Vegan home crafts,"Hey everyone! I recently started making my own vegan soaps, a very addictive hobby. Soap is one of those everyday items that often contains animal products, even though it’s not necessary, and ingredients are often cryptically labelled. It got me thinking, what other home crafting projects are other vegans working on?"
vegan,Established vegan worker-owned cooperative seeking investors through the SMBX,"In case anyone is looking for ethical investment opportunities, we're offering bonds with 8% return with monthly payments for 36 months. Please visit [http://smbx.in/smi](http://smbx.in/smi) for more info. Happy to answer any questions people might have.

After only four days on the market, we're already over 2/3rds funded!"
vegan,I am so glad I went vegan. Let’s safe the environment and the animals.,My family gives me a hard time about becoming one and I don’t even last without meat. They said people kill animals to eat and get our meat. That’s what they do. Welcome to reality. I’ve been one for a year without meat! Prince them wrong. I can’t eat meat anymore. I still eat junk food hear and there. Stop eating meat and safe the animals!
vegan,20 Reasons To Go Vegan in 1 Copypasta," 479 million goats/year [1](https://ourworldindata.org/meat-production)🌱 574 million sheep/year [1](https://ourworldindata.org/meat-production)🌱 656 million turkeys/year [1](https://ourworldindata.org/meat-production)🌱  69,000 million chickens/year [1](https://ourworldindata.org/meat-production)🌱 1,500 million pigs/year [1](https://ourworldindata.org/meat-production)🌱 302 million cows/year [1](https://ourworldindata.org/meat-production)🌱 at least 900,000 million fish/year [2](http://fishcount.org.uk/published/std/fishcountstudy.pdf)🌱 at least 300,000 whales and dolphins in fishing bycatch/year [3](https://www.fishforward.eu/en/project/by-catch/)🌱 250,000 endangered turtles in fishing bycatch/year [3](https://www.fishforward.eu/en/project/by-catch/)🌱 salmon farms pass diseases to wild fish populations [4](http://www.eurocbc.org/Effects%20of%20Aquaculture%20on%20World%20Fish%20Supplies.htm)🌱 carnivorous fish farms require even more wild fish feed [5](https://cdnsciencepub.com/doi/full/10.1139/cjfas-2016-0379)🌱 1/4 shark species threatened with extinction due to fishing [6](https://www.ncbi.nlm.nih.gov/pmc/articles/PMC3897121/)🌱 77% agricultural land for only 18% calorie/37% protein supply [7](https://ourworldindata.org/global-land-for-agriculture)🌱 livestock account for 31% of food emissions [8](https://ourworldindata.org/food-ghg-emissions)🌱 twice as many emissions for livestock over crops for human consumption [8](https://ourworldindata.org/food-ghg-emissions)🌱 only 6% of soy is grown for humans [9](https://www.ucsusa.org/resources/soybeans) 🌱 animal farmers given legal exception to bestiality laws [10](https://www.researchgate.net/publication/320208999_How_Meat_Changed_Sex_The_Law_of_Interspecies_Intimacy_after_Industrial_Reproduction)🌱 environmental racism of placing polluting animal farms in marginalized areas [11](https://europepmc.org/backend/ptpmcrender.fcgi?accid=PMC1440786&amp;blobtype=pdf)🌱 65% lactose intolerance worldwide [12](https://medlineplus.gov/genetics/condition/lactose-intolerance/#frequency)🌱 right-wing ideologies predict greater acceptance of animal exploitation and more meat consumption [13](https://www.sciencedirect.com/science/article/abs/pii/S0191886914000944) 🌱 milk and ties to nazis [14](https://ro.uow.edu.au/cgi/viewcontent.cgi?article=1373&amp;context=asj) 🌱 working in animal slaughter tied with PTSD, increased violent crimes [15](http://animalstudies.msu.edu/Slaughterhouses_and_Increased_Crime_Rates.pdf)🌱 imported colonizer animals replacing native biodiversity[16](https://ourworldindata.org/what-are-drivers-deforestation) 🌱 farmed honeybees endanger critical native pollinaters and reduce species biodiversity [17](https://www.wired.com/2015/04/youre-worrying-wrong-bees/)🌱 human slavery in fishing supply chain [18](https://www.unodc.org/documents/human-trafficking/Issue_Paper_-_TOC_in_the_Fishing_Industry.pdf)🌱 amazon rainforest &amp; indigenous homes destroyed for harvesting and feeding cows [19](https://www.amnesty.org/en/latest/news/2019/11/brazil-halt-illegal-cattle-farms-fuelling-amazon-rainforest-destruction/)🌱 watchdominion.com [20](https://www.dominionmovement.com/watch) 🌱 go vegan [21](https://veganbootcamp.org/)"
vegan,"So this weekend in my home lab, I created a pretty nice vegan leather. It honestly looks and feels like animal hide. I'm still trying to figure out what to do with the idea, but I'm curious what you all might think.","Not posting pictures yet, but just wondering what the community thinks.  I know there's a TON of various products out there.  How to get from here to there, I guess, and looking for suggestions.

I have an existing patent for another invention, and honestly it's a grueling and expensive process.

Know any companies with ""idea submission"" processes?"
vegan,AI made a pro-vegan song,"What do you think about that?

&amp;#x200B;

 I'm the vegan MC, and I'm here to sa

 I'm not eating animals, 'cause they're not meant to slay

I don't need their flesh or their blood on my pants

I'm getting all my nutrients from corns and from plants

I'm the vegan MC, and I won't eat your meat

I don't need it to survive, I have alot to eat

Eating animals is wrong, and it's time that we all see

That we can live without harming others on the ground and from the sea"
vegan,Designer bags,"So I just got my first big girl job and I've always wanted to treat myself to a nice bag once I achieved this milestone. In my research in the resale market, I'm finding it so incredibly frustrating how many brands put unnecessary leather detailing on their canvas/nylon bags. There are so many nice non leather bags out there that literally have leather lining on the inside, it makes no sense and it's disgusting. I don't want to see animal skin on my bag, even if it's hidden. So many brands now have stopped using real fur and acknowledged its cruelty, but where's the outrage for the leather? It's complete virtue signaling and is incredibly frustrating"
vegan,I would like to expand my cultural appreciation through vegan food. Can anyone suggest food from regions that have lots of vegan cuisine?,"Hi. I have made it a point to switch over to a mostly vegetarian and vegan diet.  A couple different things have led me to this (animal rights concerns, unteaching myself things that my abusive family taught me, realizing that eating certain meats and animal products causes me gastrointestinal distress, seeing a mother fox get hit on the road and the reaction of her kit).  Anyway, I've been trying to eat meatless for about a month and dairy-free for about two weeks.

That said, I grew up in a very conservative southern home where my dad hunted, and my mother always had to cook meat with every meal.  All the foods we ate were very ""Traditional American"" (for lack of a better term).  This has made the switch sort of difficult because I'm having to relearn how to cook.

To make matters a bit more difficult I am extremely allergic to soy and I'm not a massive fan of meat substitutes.  I've found that, where I live, most vegan convenience foods have a good amount of soy in them.  Due to that I have been cooking everything from scratch.

So, I have been mostly eating bean and rice, stir fries (using Maggi's as a substitute), and Indian food.  I do enjoy proteins that are not reminiscent of meat.  I've made chickpea tofu and cooked with Pumfu a couple of times now as well.

I have noticed that I'm happiest when I prepare foods from cultures that don't eat as much meat instead of making carnist food vegan.  Specifically, I've been really enjoying Indian food.  It makes my home smell gorgeous.

I would like to explore more food from cultures that traditionally do not use as much meat or animal bi-products.  I feel that exposure to different cultures through food is helping me not only learn to cook differently but also to gain appreciation for cultures that would have been shunned by my conservative parents.

With all that in mind, I am searching for traditional dishes from other parts of the world to make in my home.  Can anyone help with ideas?

Thank you so much."
vegan,Do you think you could convince your 'old self' to go vegan?,"Back when I was a teen/younger adult, I was that edgy guy who didn't think about much. I guess I did, was big into self discovery and becoming a ""modern warrior"" type of guy. I'm Australian but really loved American conservative videos and thought I was badass. Really wanted to be a ""traditional"" man, wanted to hunt, hated lefties with a passion. Yes, Ben Shapiro was my favourite. 
Then I met a woman, we worked together for a bit and started dating. She was vegan, I didn't mind but I knew I was never gonna be one. She was with me for 1.5 years before, with the help from her, I became vegan. She turned me into a better person. I could never date a non vegan now, I don't know how she did it, but she did. After a year of veganism, I still consider myself a hardcore vegan, would still never date a carnist or vegetarian. Veganism just seems so right and I don't see how past me could do such stupid shit. Anyways, rant and shower thoughts over.  Peace out my homies. 

P.S fuck Ben Shapiro"
