subreddit,title,selftext
vegan,Will the climate crisis lead to an early vegan societal shift?,"Hi everyone, I've been vegan for six years now and it's the best decision I ever made. I want to ask you all a question about animal agriculture, climate change and persuasion. 

I am disgusted by the level of cruelty and the shocking levels of violence that go on behind slaughterhouse doors. Not to mention the amount of greenhouse gases factory farming produces- more than the transportation sector. Every day, I grow more angry about factory farming and more hopelessly dejected in the face of the climate crisis we are inevitably facing by this point. 

&amp;#x200B;

In my view, the best move forward for morality's sake and for climate change mitigation is to end factory farming.  End the abhorrent cruelties and denial to rights of life while, at the same time, seriously reducing greenhouse gas emissions, land usage, water usage and deforestation. It would obviously be a game changer in the movement to curb climate change if we were able to do this- the effects would could save thousands if not millions of human lives that would be lost due to the effects of climate change, not to mention the literal billions of animal lives spared from horrific fates. 

&amp;#x200B;

My question is- how? How do we get there? Do you believe there is any hope for this goal of ending factory farming sooner rather than later for the sake of mitigation of climate change and environmental destruction? This seems to be the only way to frame it to people as framing it as a morality issue / animal rights issue often gets you nowhere (with some people- I know there are  exceptions to this rule). But when people are scared for their lives and their personal livelihood, as the pressures of climate change increase, would they then go vegan on a mass scale? Animal rights  and philosophical appeals seem to change individual behavior, but I'm not sure it's going to grow large enough to have any effect against climate change in time. Especially since the issue is so polarized- only ""radical leftists"" go vegan. 

&amp;#x200B;

I don't mean this to sound like a doomsday post, but I am very concerned about the state of climate change and animal welfare today. I would love to hear your opinions on this topic."
vegan,"I got sent this supplement for free with my recent Vegetology order. I'd love to give it to a vegan in need, if any of you are interested.","There was no option to refuse this supplement with my order, they just included it automatically. I can't take it because it has iron in it and I already get that from my multivitamin.

I'd love to give it to someone who really needs it, so please don't request it if you could afford to buy it yourself.

Basically, the first person who DM's their address to me, I'll send this to you for free.

It's got 1000 mcg of B12, so it could be a good B12 supplement. Also has a bunch of other stuff, see [here](https://www.vegetology.com/supplements/active-energy).

THIS IS NOT A SCAM. I just don't know any other vegans and I don't want this to go to waste.

Picture of the supplement so you know I really have it. The bottle is still sealed. https://i.imgur.com/CVjTQ0M.jpg"
vegan,Collecting info on veganism,"Hello everyone,
I try to get educated on veganism as much as I can. I want to be able to answer questions when asked and inform people. What are the questions that you are asked? Also what are the misinformation nonvegans spread? 
Example for the first: would vegans eat eggs if chickens were raised humanely?
Example for the latter: vegans are responsible for more animal deaths through crop death. 
I will make my research, but be my guest if you feel like lecturing"
vegan,a question for quinoa pro's,"So I've recently experimented with popped quinoa and honestly it's not that much different in texture and barely different in taste. Maybe I'm doing it wrong or maybe my pallet is just not evolved.

Anyway, do I need to pop or cook it? Can I just eat it as is? I mean it's technically a seed right? I'd like to just throw some in cereal or granola or something."
vegan,If vegans weren't weird they would listen to you...,"Vegans are weird asf, they never are well put together people who live a corporate lifestyle, or a lawyer of a doctor....nah they are hippies and long haired weirdos most of the time. Aesthetics are more important than you think and if you like something people don't like looking at, then no one wants to be like you. 

Also as a latino dude, try getting latinas saying you are vegan, they would dump me in a second, jesus I mean the moment you reject their parents or grandmas cooking, I don't even know how you say ''I'm vegan'' and escape there alive without being considered a pathetic person lmao. 

I understand it but dang being vegan is so inconvenient to my life"
vegan,I'm giving up,"There's no point in fighting. As I'm writing this, it's past midnight but I can't sleep because there's a local fair with a loud ass music that won't stop. It lasts several days. The fair served only lots of corpses by BBQ (yay I can gasp for air) and it's filled with drunks. I can't fight for humanity or the animals, this planet is filled with people like this. Goodbye hope in humans I guess."
vegan,Non-vegan restuarant leftovers,"Took the family out for dinner including my parents. My parents have known for 5 years now that we are vegan and don’t allow animal cruelty in our home. The Italian restaurant we went to has the most flexible menu that you could imagine for vegans, non-vegans.and gluten free. It was bad enough that knowing we were paying for the dinner that they would order veal, shrimp, etc. but have the nerve to want to pack up the leftovers and bringing it back to our house where they were staying for the weekend. I politely reminded them that we would not be taking their leftovers back to our house. They then made a non-revenant upset remark that even my aunt and uncles who keep kosher at home wouldn’t have a problem. My response was simple, don’t like it… find your own way back and pack your bags, your outta here. They wouldn’t accept our firm stance. Screw em!"
vegan,For those who can: Please sign this!,"This petition is mostly directed toward those in Sweden, but others in Europe or even outside might be able to sign it? I'm unsure, but please take a look and see if you can sign it!

It is a petition for a fur-free Europe, and to close all fur-factories in Sweden.

https://www.djurensratt.se/eci-steg-2?utm_source=share&amp;utm_medium=webshare_api&amp;utm_campaign=K83hxlADMfpqhimXmkP-0Co59U0aITgu_GnqA0NT-fQ"
vegan,I can't believe that people still believe that if we didn't breed animals we would run out of food!,"Someone honestly asked me ""How would we feed people if we didn't breed animals?"" 

I can't really blame them. My parents told me the same thing, and I believed them. I never stopped to think ""Well we feed 80 billion land animals, I'm sure we can feed 7 billion."" As a kid, I thought it was just a fact of life."
vegan,Which animal is the hardest to get people to stop eating?,"

[View Poll](https://www.reddit.com/poll/vg151v)"
vegan,Should I appeal to my parents wanting to be healthier to encourage them to go plant-based?,"Hello! Due to a couple conflicts in my life (living at home, ED recovery) I am currently a vegetarian who attempts to minimize animal products in my diet whenever possible. I don't buy animal tested cosmetics, and aside from my leather work shoes I was gifted about a year ago, I don't wear animals  either. I keep up to date with vegan news and support vegan options whenever I can. Essentially, I am doing my damnedest to prove I am just another """"""annoying vegan"""""" and not on the verge of a relapse. 

Enter my parents, who have taken an interest in my habits, but couldn't care less about the ethics behind it. They're still in the mindset of ""this animal is for loving, this animal is for eating/breeding/enslaving"" :/ 

It is very frustrating to listen to them discuss amongst themselves how hard it would be to ""go on a vegan diet"" and when I try to discuss the actual lifestyle changes that would come with that, I get brushed off. I'm too extremist because dairy cows and hens ""don't get killed"" so obviously there's no reason at all to avoid those ""food groups"" too, besides avoiding saturated fats of course.... 

So now I'm wondering if it would it be wise to continue encouraging this train of thought if it means more lives saved? But at the same time, they have made absolutely no lifestyle changes before, and have a horrible track record of commiting to such, so I have no idea if it's worth the headache of watching someone continuously ""consider"" reducing their meat/dairy intake but not actually do it -_-;;"
vegan,Knife work classes?,"My wife is a vegetarian and wants to work on her knife skills in the kitchen. I have found some classes for her in salt lake city but they do a lot of work on meat, like breaking down chicken and ribs. Anyone know a place or even online deal that could help her without any meat? Thanks in advance and hope this post is ok here."
vegan,"Isn’t funny how people are SO worried about vegan / vegetarian deficiencies but 92% of Americans are 92% of U.S. Population Have Vitamin Deficiencies. So they eat junk food all day, not a balanced diet, but it’s only a problem when it comes to vegans and vegetarians. They think they’re superior","92% of U.S. Population Have Vitamin Deficiency Most American diets people eat are lacking all those too. They just eat junk food. But they’re worried 90 percent of Americans of color are vitamin D deficient 50 percent of Americans are deficient in vitamin A, vitamin C, and magnesium. More 50 percent of the general population is vitamin D deficient, regardless of age.. Approximately 70 percent of elderly Americans are vitamin D deficient

Source: https://thebiostation.com/bioblog/do-you-have-vitamin-deficiency/

I copied this from a user on another subreddit so credit to U/MileHighHabesha"
vegan,Suggestions needed! Putting together a care package for my friend in the UK,"Hi friends! Sorry if this isn’t the right place to ask, but I’m putting together a care package for my friend in the UK, and I’m in need of suggestions for some yummy 🌱 snacks to include that would hopefully withstand the trip given the summer heat. I searched for relevant posts, but there weren’t any recent ones. I’m located on the east coast USA if that helps. Thank you so much in advance!"
vegan,Its An dumb qeustion but what Community is better,"Rule: no sarcastic awnsers pls...

[View Poll](https://www.reddit.com/poll/vfxwnp)"
vegan,Here is why the Faroese are called the last barbarians of Europe...,"I'm sure many of you have heard about the Yulin Dog Meat Festival, where the Chinese torture and kill thousands of dogs to consume their meat. 

I used to believe that an atrocity like this was inconceivable in Europe until I stumbled upon this [documentary](https://t.me/documentaryplanet/136). 

Up to 1,000 pilot whales are killed for meat each year on Denmark’s Faroe Islands. Dozens of men in small boats drive the mammals into a bay and use hooks and knives to kill them. Called the grind, it’s a terrifying sight but also a centuries-old tradition. While animal rights activists call for an end to the custom, the islanders say the grind is part of the Faroese identity.

How much longer do you believe this kind of animal cruelty will exist in the world?"
vegan,Hopelessness and sadness,"How do you handle feelings of hopelessness? Even as I write this, thousands of animals are being killed while other wait in fear to be next. After 10+ years of this lifestyle I still weep, I still hurt, I still wish I could run in and save them all. I know I can't, I know the work we put in to stop it, I KNOW. But how do you deal with it? Knowing that 100% isn't enough to save them all? What are some of your coping mechanisms? TIA."
vegan,What if everyone in the Earth become Vegan one day?,"What you think wil more likely to happen?

[View Poll](https://www.reddit.com/poll/vfwdeo)"
vegan,UK vegans - what's next for vegan food at McDonald's,"Little disclaimer - I know some vegans don't like McDonald's. If that is you then just please scroll.

I was wondering if anyone had any insight into what McDonald's might do next in terms of vegan food? I absolutely love the McPlant and 2 things that I'd really love to see next are either vegan chicken nuggets or a vegan McFlurry."
vegan,Anti-Dairy Plea at my Wedding,"I'm getting married in two days, and the wedding's going to be entirely vegan! During the wedding, our caterer intends to print menus to distribute to our guests. We've decided to include a short write up on the other side of the menu talking about veganism.

Since the wedding's going to be happening in India, and we're primarily catering to a vegetarian crowd, the write-up is mainly focused on the ethical reasons against dairy farming. Would love some feedback!

**Please Read**

All food at this wedding is vegan. We are both vegans, and wanted to use this wedding as a platform to promote veganism.

What is veganism? Veganism is not simply a dietary choice, but a philosophy that seeks to minimize animal exploitation and cruelty to the greatest extent possible. This means not consuming any food products extracted from animals (such as milk, yogurt, honey, etc.), and not using any products made from animals (such as leather, fur etc.).

You may ask why dairy products are also avoided by vegans - after all, isn't milk given to us freely by cows without any suffering? Ultimately, isn't it the cows' duty to provide for humans?

The reality is that the horrors of the modern dairy industry are hidden from us. Cows are injected with growth hormones and forcibly impregnated against their will through artificial insemination to keep them constantly lactating. The vast majority of male calves born to these cows are sent to slaughterhouses to be sold and exported as beef.

Cows may not have the same ability to think and rationalize as most humans do, but they are also creatures with emotions and feelings, and are able to feel pain and suffering. Cows have the same maternal instincts we do to protect our young - when their calves are snatched away from them, their mothers are seen in obvious distress, just like human mothers. Why must our tastebuds and desire condemn them to such a life of agony and despair?

Although cows have a lifespan of up to 20-25 years, the repeated pregnancies and constant lactation quickly take a toll on their bodies. By the time they are 6-7 years of age, they reach the end of their milk-producing capacity, and are then also sent away to be slaughtered - an abrupt end to a miserable existence. India is one of the largest exporters of beef in the world today, despite the fact that we consider cows sacred - have you stopped to wonder why?

Those of us who consume dairy are often under the illusion that dairy is a food product that has no victims, and that we are entitled to it. But the reality is that, by continuing to consume dairy, you are directly supporting the beef industry and are complicit in the slaughter of millions of innocent animals.

Through the food being served at this wedding, we hope to convince you that food made without the use of any animal products can be equally tasty and nutritious. Let us be conscious of the choices we make through the food we eat, and take responsibility for the impact we have on the planet."
vegan,Vegan holiday to Europe?,"Anyone got any recommendations for areas, hotels, restaurants, etc in Europe- specifically along the Mediterranean coastline, or Portugal. My girlfriend and I really need some decent sun, and an easy package holiday would have been nice but I think we may have to go down the self catering route.

I wonder if there are any vegans who have been on holiday to southern Europe recently, or even any residents who can give us some good recommendations?"
vegan,A potential YouTube gem for vegan athletes!! https://youtu.be/zp07Rfydhrg,"Hey all, I just found this new youtube channel that didn't seem too appealing but I gave it ago and was very pleasantly surprised at the nutrition information for vegan athletes. I think this might be a channel to watch and give the vegan athlete community a great example of the possibilities, check it out! :) [https://youtu.be/zp07Rfydhrg](https://youtu.be/zp07Rfydhrg)"
vegan,Finding a job as a vegan.,"I've made a post on here some time ago, asking about what's acceptable as a vegan, and people made me feel better about what my options may be, anyway, a few months later and I've finished up with some at home work and I'm now looking for a job.

Basically, I've been vegan for over 2 years now and absolutely only want to do things in my life that help animals and the environment, but now that I need a job, it has come to my attention that my area doesn't have the best options at the moment and that worries me.

And so one place that I found that needs a worker is Domino's (they need a delivery driver), and there's another place for stacking books and such. So because it was a Sunday here today, Domino's was open so I called them, and they called back soon after, and said that I can come in tomorrow for an interview.

So after that, I was relived as I may soon have a job again, but then I started to feel sick that I didn't wait till Monday to call the book place first (the reason I did this is because I was intending on trying to get both jobs as they're part time, so I figured I was going to be calling Domino's anyway), but now I feel terrible and hope that I blow the interview, as I'm not sure it's very vegan of me to work there.

Basically, in my panic of feeling like crap, I looked up on another vegan site about people looking for jobs, and almost all of those people were saying that you shouldn't get a job that's not entirely vegan, which is quite different from what I've heard, so that made me feel worse basically, so that's why I'm making this post.

So what do I do? I really need a job or two part time jobs, and there aren't many options here, I could just try and get the job at the book place and hope it works out, or I could try really hard to get both to put myself in the best position while feeling bad because I'm vegan.

I was thinking that Domino's has quite a few vegan pizzas now and that made me feel better, plus I thought that if anyone asked for a recommendation for what pizza they should order if ever that happened and if ever I answered the phone, well I could recommend a vegan pizza, until I quickly realised that no one wants to hear what a vegan has to say, but anyway idk, what should I do? And where do you guys work? (if you don't mind telling), anyway, thanks for anyone who can help me make a decision :)

&amp;#x200B;

TL;DR. I need a job, there aren't many in my area though, am I able to work at non vegan places as a vegan, as I need the money, or do vegans all work at vegan places (which for me seem to be quite hard to find), what do I do?"
vegan,"Sustainable, Ecologically Friendly Honey","Every time I get into a discussion with the ""beegans"" or ""eco-friendly"" lifestylers in my circles, they get upset with my skepticism of honey, beeswax, and beekeeping.

We live in Canada, where honeybees are not a native species. Every hobbyist beekeeper I have spoken to needed to truck in hive after hive of honeybees, as they could not raise them faster than they perish from poor health and disease. They really don't belong here and hurt native species.

Still, they are very excited and confident to preach about how the honey *they* get comes from small, local, eco-friendly, sustainable beekeepers that also donate all of their profits to local conservation efforts.

So, every time I ask them, ""Ah, that sounds really wonderful. What apiary do you source your honey and beeswax from?"" they suddenly seem to have a really hard time answering a simple and straightforward question. ""I'm researching"" is usually what they say. 

Sometimes they tell me they get their honey from Amish farmers. You know, *the same farmers known for grinding barn animals down to the bone and running puppy mills.*

...Just a vent post."
vegan,I don’t know if I want to be vegan anymore,"I originally became vegan almost two years ago. I went vegan after watching a documentary on how animals are treated in factory farms. I started researching more into the philosophy of veganism and found myself largely agreeing with it, and realized how much sense it made. I still mostly agree with the philosophy.

Fast forward a couple years later and I don’t know if I belong in the vegan movement anymore. The funny thing is the reasons for that have nothing to do with the philosophy itself. It’s more about the culture around veganism that I can’t stand.

1. Veganism is extremely left wing

Veganism is heavily aligned with left wing politics. I don’t like the idea of getting sort of a “packaged deal” with being vegan. I cared about the animals first and foremost. I didn’t want to have to accept a bunch of other political dogma along with it.

2. Lack of food options

It’s easy to dismiss this with “well that’s selfish that you value convenience over the lives of innocent animals”, and well, that wouldn’t be wrong per se. It still sucks either way. There aren’t a whole lot of vegan options at restaurants and stuff where I live so I everything I eat I have to make myself. And frankly, I’m lazy as fuck. I don’t like having to plan and make all my meals. But that’s pretty much the only option I have because there just isn’t enough pre made vegan options. Everything requires planning and time spent out of my day preparing it. It’s just extremely inconvenient. Like 99% of stuff in grocery stores and restaurants isn’t vegan. Again, I don’t think my inconvenience trumps another sentient life, but it’s just really tiring frankly. I wish there was just some premade meal I could buy so I don’t have to prepare food (and don’t suggest soylent, i’ve tried that but it doesn’t leave me satiated for some reason so I stopped drinking it).

So what do you think r/vegan, should I stay vegan or go back to eating meat?"
vegan,Can you be a vegan and still want mosquitoes to go extinct?,"Since mosquitoes spread deadly diseases and are the number one cause of death for many animals including humans, is it justified for us to get rid of them?

[View Poll](https://www.reddit.com/poll/vfogno)"
vegan,Dear Vegan Men,"Most of you suck. 
I don't know why, but you guys are terribly hard to befriend. 
I've DM'd you'll far more than I've dm vegan women, but majority of my friends have been women. Like- has high women ratio or something in the vegan community made it so that my dms don't give you any dopamine? 

A lot of you'll leave DM on read or never click, unless it's from women. 
Am I in the wrong for trying to make friends online? Am I super un-cool? 
Am I doing something wrong by trying to initiate conversations about hobbies or various other things? 


I don't think I'll believe people if they say misandry isn't real."
vegan,Beyond burger stopped being good,"Five years ago, I visited some lifelong meat eaters on the US who'd gone (mostly) vegan. They grilled up these Beyond burgers things.

I never saw the point of imitating meat, so was expecting something unappealing. And back when I ate hacked up animal tissue I hated rare, because I find eating dead animals gross, from taste to recognition. 

But this? This was everything good about eating beef, and none of the bad. The bleed thing was interesting, the taste was really good, without that icky ""I just ate lard"" aspect. Winner!

We started buying them regularly.

Then the company ""improved"" the flavor. They went from red to gray-brown. The taste was unexceptional.

Recently bought them again here in Oz, and this time we all felt like we were eating relatively flavourless stuck-together grains

I have the impression the original formula was too expensive to scale, and/or the stupid health concerns got in the way (yes, it has more salt than beef... and you can put less salt on it, or just have it as an occasional treat - the objective here is taste). 

I'm just wondering if others noticed the same."
vegan,Recently made the leap into veganism!,"I expected the snarky ""I could never!""s and the ""but cheese is soooo good"" (which is funny to me because I actually gave up dairy first, feel free to judge if you want lol) I expected the accusatory remarks about how going vegan is actually terrible for you and its a privilege and therefore elitist and/or classist and also worse for the environment than meat and dairy somehow. And I've gotten all of that and brushed it off.

But I did not expect to constantly get the weird ass question, ""so are you going to/do you still eat fish?"" Morbidly fascinates me to find out how few people view fish as animals/meat."
