subreddit,title,selftext
vegan,Joe Rogan's Podcast almost convince me to go back to meat diet,"[Joe Rogan Podcast](https://open.spotify.com/episode/0r7MbKFhtLf9RLOahCT1gU?si=4b8e25cc6cbd4c75) I just finished listening to this episode of Joe Rogan's podcast and I'm very doubtful about my Vegan diet. It's been a long time since I had meat, even though I want to try meat to see how I start feeling again I can't think of going back because looking at the meat feels disgusting.  I think it finally comes down to which diet works for you. All thoughts and comments are welcome."
vegan,What are super easy/quick vegan recipes?,"I’ve been on a budget and being vegan can be expensive for alternatives. I’m looking for easy recipes that are quick to make since I’m so exhausted all the time (I’m 7 months pregnant) but problem is, I’m so picky. Like sooooo picky. I hate myself for it. I find myself eating out a lot and I really don’t have money to be spending on that anymore. I have no food for me in my fridge or pantry so I need to go grocery shopping. I like whole grains and legumes, some veggies and tofu but I just don’t know what to do with that stuff because I will not eat anything bland lol. Any tips or recipes are appreciated!!"
vegan,Going vegan in a hotel,"I have been plant-based on and off for about 5 years due to living situations growing up (21F), I would like to align my morals with my lifestyle and adopt a vegan lifestyle, I am switching my makeup to cruelty free as well as hygiene product. My only dilemma is currently working at a job who profits off of mainly selling animal products until September when I move, as this is my main source of income while I’m in school. 

Diet wise I would like any input on a vegan diet while in a hotel for the next 2 months for work, I only have a full size fridge w/ freezer and a microwave. I already love vegan meat/dairy/eggs substitutes, and just would like any opinions on grocery lists, or meals. Thank you!"
vegan,TW/ YouTube animal abuse. Name: OrbicMist264,"As posted on r/animals , there is a person posting videos of them torturing and killing guineapigs. I’ve tried to find their countries to contact police but can’t find it anywhere. If anyone is good with computers can find his location, or report the account for animal abuse, please please do. Won’t post any photos/ videos here as it’s very upsetting. Look at the channel with your own discretion. Please upvote to bring more attention to this."
vegan,New Vegan Video,"Hi. I'm very new to activism, but I recently went around my city showing slaughterhouse footage. I made a video out of the best interaction I had, and I would love to share it with you all. The person I talked to was very receptive to veganism and later even told me he was going to try being vegan!

[https://youtu.be/1BHgSWq8-Qw](https://youtu.be/1BHgSWq8-Qw)"
vegan,Trying Plant-Based diet (New to it),"Hello everyone! I’m fairly new to this but, I wouldn’t quite consider myself Vegan per say, but I’ve been focusing more on plant based foods in particular. I had recently come across “Seitan” and I’ve scoured the internet but can’t seem to find any recipes to use it with on a budget. I would greatly appreciate any tips or recipes or just ideas I’m general about a plant based diet! I hope y’all have a wonderful day! Thank you for your time!"
vegan,I'm hurt,"I don't know how I was able to abuse animals for so long without seeing the truth. I watched dominion. And I realized how twisted, and horrid I have been acting. I was abusing animals for so long, and for what? I have recently turned fully vegan, and I'm working on ridding my house of any animal products. 
Any ideas for any vegan recipes I can eat?
I want to apologize for how I've been acting."
vegan,"New to this, sick, help","Guys I just started and am about a week and a half in, and I feel so weak and sick. I've started being so sweaty and shaky. My partner warned me about possible protein deficiency.  I've been eating smoothies with loads of berries, and last night we had tacos made with walnut meat. I do have a plant protein supplement. How do you guys do this? Do you count macro nutrients? Plz send recipes, tips, and help. This is so important to me and I don't want to give up."
vegan,How to deal with apathy?,"When I talk with people about veganism I often get counter arguments which I can meet head on and address.

What I really struggle with is people who agree with me but give such silly excuses which often boils down to apathy or laziness. How do you even begin to tell someone they should care about external factors like environment or animal welfare when they don’t even care about themselves?"
vegan,For vegan ADHD sufferers struggling to find suitable medication,"I was recently diagnosed with ADHD, and when it came to getting medication my choices were *very* limited (I'm in the UK). Almost every option my doctor was able to offer either had shellac or gelatin, and all of them contained lactose. However the odd one out was **Xenidate XL.** 

It was free of any of the aforementioned ingredients, but it did contain Magnesium Stearate, which can be derived from either plant or animal sources. After two weeks of talking to the manufacturer's customer support, they were able to confirm that Xenidate XL is entirely free of animal derived products :)   


Unsure of Xenidates availability in other regions, but hopefully this can help people in a similar situation to me."
vegan,how much land per grass fed cow? (serious questions),"how much land needs a grass fed cow? without hay or other external imputs, cowspiracy says it requirese 4Ha(10 acre) per cow, grass fed advocates says between 0.4 and 1 Ha(1 and 2.5 acre)

it is actually possible to feed a cow with only grass? no hay, no silage?

do these grass fed carnists dont eat out?

is really true a single cow can feed a person for one year?

do grass fed carnists eat fish, chicken and pigs?"
vegan,Looking for other people with non ridding horses/ Horse Sanctuaries on Reddit,"Hi there folks!! 

My family and I are all vegan and we adopted a Mare this year. We rescued her from a local farmer who’s routinely impregnates and continues to uses his mares. Anyways, she was in really rough shape and also pregnant. 

Almost a year has gone by and she has given birth to our beautiful little girl Star. We want to give them a life where they can just enjoy being horses.

Genesis (Mama horse) will never be separated from another one of her children. Star is her last baby and her forever baby. She will have Star near by for the rest of her life. Of course neither will be ridden.

I’ve seen some spaces on FB for other people raising/caring for non ridden horses and I’m wondering if there are any here?"
vegan,Am I too harsh on my mum for being vegetarian as she claims it's too hard to be vegan while being gluten-free?,"I have been vegan the past 5 years. At the time my parents weren't vegan but my mum had been vegetarian when she was a teen/young adult. She went back to eating meat when she was 36. 

She says that she did it because we moved to a beach town and she felt like it was okay to eat the fish since it was local and then slowly fell back into eating all meat and not really caring other than buying free range. However she says she really regrets this now and could never eat meat again.

Mid 2020 her and my dad watched Game Changers and decided to go vegan. My dad has stuck to it, however he does it for his health. He injured his leg in his early 20s and has always had a swollen leg/pain/limp. When he went vegan the swelling reduced and he has a lot less pain now, so it's important for him to stick to it for that reason.

My mum has been gluten-free for somewhere around 10-12 years (she's 50 now) as she discovered she had an intolerance so she can't have any gluten at all.

She did try to stick to veganism but gradually started eating eggs and dairy again. She claimed it was too boring only being able to mostly eat curries and salads at restaurants. She said she was gonna be fully vegan at home and eat vegetarian if there was no vegan gluten-free option available.

However this is not what she does now. She eats dairy butter &amp; chocolate sometimes at home as she says she likes to ""treat"" herself and something along the lines of ""since my options are limited I need to have this to not go crazy."" She also eats eggs most mornings as she claims that she can't function with them.

It just really pisses me off as I'd rather her just admit that she just wants to eat butter &amp; chocolate &amp; eggs rather than claim she NEEDS to have them when she doesn't.

However. I do empathise with her as I have gotten a mild gluten intolerance off of her which means I can't eat gluten sometimes as well and it can be frustrating when you don't get to eat the food you want. I really do understand that. 

And to be honest, I did respect her initial decision to be vegan most the time unless there was no vegan gluten-free option available at a restaurant. 

But she will still get something vegetarian even when there's something vegan &amp; gluten-free. For example, we went for an Indian and she got a halloumi curry even though there was loads of vegan gluten-free curries. She has even opted for dairy cheese at a restaurant when vegan cheese was available.

I just find it so frustrating. But as someone who isn't vegan &amp; gluten-free full time I do worry that maybe I'm being too harsh. Especially as I run into vegan gluten-free options at restaurants/cafes fairly often. If you're vegan &amp; gluten-free, what are your thoughts on this?"
vegan,How did you transition to veganism?,"I saw a comment on here that ""most vegans were vegetarians first"" and I wanted to see if that lined up. Please comment if you aren't represented in the poll!

[View Poll](https://www.reddit.com/poll/va1ti1)"
vegan,8 years vegan with recent stomach pain,"I’ve been vegan going on 8 years. When I first went vegan, like a lot of people I’ve talked with, I experienced a bit more gas. But I wasn’t uncomfortable — in fact, I had never felt better. But this last year has been sort of tough. I haven’t changed my diet hardly at all, but I’ve been having some severe stomach pain from digestion and gas. My bowel movements are normal and I feel like myself otherwise. Can anyone shed light on what might be happening?"
vegan,How did you start eating vegan in your omni household?,"Among my family of two parents and three nearly adult kids, I (a parent) alone have become a vegan. I’m just wondering how people in similar boat worked out feeding yourself and omnis and if and/of how you were able to incorporate vegan family meals and perhaps even convert some family members. Right now it just feels like an uphill battle and something I can have to do separately, but that needs to stop. Thanks!"
vegan,"40+ Yr old male, new vegetarian with plans to go vegan except....","I became vegetarian 4 months ago with the plan to fully convert to vegan in 6 months. I immediately noticed a loss of weight, which was my primary goal, but I also noticed a significant drop in testosterone.

I heard this reduced testosterone would likely be a side effect but was told it would eventually balance out.

I've tried researching this but every site seems to contradict the other. 

My question is, and this is primarily for any long term middle aged male vegetarian/vegans, is it normal for testosterone to drop and have your testosterone levels returned to normalish levels?

My concern is that male testosterone naturally decreases around middle age and I certainly don't want to encourage it with my diet."
vegan,"Vegan food replacements (Impossible meat, vegan cheeses, etc) are presumably developed through having people taste them side-by-side with the animal product. How is that not the same as animal testing?","Vegans don't use things like shampoos that were developed through testing on animals - even though there is no ongoing suffering for animals, the suffering was necessary in the initial development of the product.

Naturally, meat and dairy replacements aren't developed in a vacuum. A vegan wouldn't be able to develop a replacement product and say ""Ah yes, this is what I remember meat being like 5 years ago"". You need an active meat-eater to taste the real and fake meat and say ""Yep, I think we got it just about right"". So you have to eat the real meat initially to develop the fake meat.

But how is that different from the shampoo initially being tested on a lab rat for safety, before being deployed out to the human market? How is deploying a previously-animal-tested shampoo different from deploying a previously-beef-compared fake meat?"
vegan,I watched Dominion...,"Lemme tell you, I (18F) have never been so disturbed or heartbroken by something in my entire LIFE.  I don't cry, ever.  I'm a deeply sensitive person but I never actually get to the point of crying.  I got to the part with the chicks being ground up and exploded into tears.  

I've been a strict vegetarian for almost 3 years but I decided to transition to vegan yesterday.  All animal products out the window.  I'm in the process of replacing all my skincare products with vegan ones.  

I'm just wondering why I never made this choice sooner and why so many people ignore the cries of the innocents."
vegan,Looking for advice on going vegan,"I’ve long wanted to go vegan and have tried to ease myself into it by doing a few vegan meals per week, then a vegan day, then multiple. I went 2 months and was just so damn hungry. Like my body doesn’t recognize the meal as whole unless there is meat. But I want to get away from this.

How did you transition into vegan?"
vegan,I don't notice anything of inflation :),"People who say ""veganism is expensive"" are stupid. It can easily be the cheapest diet lol. I don't know anyone who spends as little on groceries as I do.

Meat and dairy are expensive. Fruits, vegetables, beans, rice, bread, potatoes are usually the cheapest foods. And probably the healthiest too.

Yes, if you're going to buy **only** vegan meat, vegan cheese, vegan milk, then it may be expensive. But if you buy it occasionally, it probably won't hurt.

I'm glad that I can enjoy this benefit of veganism as well, apart from better health, less guilt, more love for animals and a lot more. Love it"
vegan,Really strange example of speciesism,"I just saw a tiktok where someone was making a song out of minecraft sound effects, pretty normal. One of the ways they got this sound effect was by dropping some animals from the game into the void. They dropped some sheep, some goats and some cats. And, of course, the comments were infested with 'Noooooo, Kitties!!!' 'Not the cats!!!!' and the like. Not a single person mentioned the sheep or goats. I guess their biases extend even to virtual animals that they've seen for two seconds. Carnists really do just only care about their precious cats and dogs."
vegan,A French who need help 😭,"Hello, 1st sorry for my bad English 🙏 then I need help especially from people who are french or know some vegan restaurants in France.

I want to invite my gf in a vegan restaurant because she is vegan so, seems logic. But I have ABSOLUTLY no idea which restaurant are vegan and if they're good so I need you all 🙏 for French who'll probably ask I'm living in Lyon.

So if you are french or you know some good restaurants in France please help me, thank you 🙏"
vegan,My opinion on forcing vegan diets on dogs,"Before i begin,i want to say that i support all vegan activities and diets.

First off,i don't think that it is correct to force vegan diet on a dog,why?

1-Just by looking at their teeth,you can tell they're biologically predators,and ment to eat meat.

2-enforcing a vegan diest into them,is not healthy for them,neither is it natural.

3-i know that,by letting your dog eat meat,you are indeed letting animals die,but,have in mind,that forcing a vegan diet onto a dog will do your friend no good.5"
vegan,My trash can smells nice,"I became fully vegan 2 months ago, and while it has been challenging at times, I have noticed both subtle and not-so-subtle positive differences in my life. Just today, I was cooking a vegan stir fry, and as I was cleaning up, I took note of the fact that my trash can actually smelled pretty good. What once carried the uneaten parts of dead animals and outdated dairy products now held scraps of onions, peppers, carrots, and other fruits/vegetables. While Animal Rights and health benefits lie towards the top of the long list of reasons to go vegan, a nice-smelling trash can is certainly an added bonus!"
vegan,i just had an incredibly disappointing veggie burger,"i've been spoiled by beyond meat and impossible burgers. been buying them in bulk ever since they were available in stores.

but today, because it was quick and easy and cheap, i bought some veggie burgers from aldi's. the flavor was lacking and the texture was so so weird. 

i've been vegan for about 5 years, and vegetarian for about 8 years before that. it's amazing how far these products have come since i've started. in the beginning, the kind of stuff i got aldi's was practically all that was available."
vegan,I feel disgusting :(,"I am so sad, I ordered the new vegan ice cream from cold stone and was so excited!! But when I got it, I realized like halfway through my bowl there were two or three small Reese’s in it. 

I don’t think I ate any, and I poked and pulled them out and stuff, but one was in my mouth and I feel so gross. I couldn’t finish it, I just feel so icky"
vegan,got spiked,"I've been vegan for a few years now and haven't really had many 'slip ups' because I don't eat out a lot. Anyway, on a rare occasion I ordered a falafel wrap and picked the ingredients so it would be vegan. Alas, they added dairy cheese.

When I discovered the cheese it was too late and I'd already tasted some. It tasted genuinely feral to me. Like sour and disgusting. It was shredded mozzarella and I recall enjoying this as a child. Now the taste is completely different to how I remember and even thinking about it makes me want to throw up.

Has anyone else experienced this?? I had no idea my taste buds had transformed so much but I'm not mad about it 😎 just another reason (to add to the millions of reasons) to NEVER to back EVER hahaha."
vegan,Should I compromise my morals for my job?,"I write for a newspaper and magazine owned by the newspaper. I'm also a vegan for moral reasons. Sometimes I have to write about restaurants, which makes me uncomfortable because they're never vegan. I put up with writing news stories about restaurants because at least they're news. But when it comes to the magazine, those stories are meant to glamorize things. It's a lifestyle magazine.

My boss asked me to write a magazine article about a restaurant, and I did. It didn't feel right. I sent him an email yesterday saying I refuse to write more magazine stories about restaurants, and I'm only willing to write news stories about restaurants if there's nothing better to write about. He said that won't work.

I like my job and career field. I don't want to leave either. But I don't want to support animal abuse by promoting restaurants that get their animal products from cruel factory farms. When I write those stories, I know that more people will support those restaurants as a result.

Should I just do what my boss wants? Should I get another job?"
vegan,Jurassic World Dominion a Vegan Film?,"Okay, so \*\*\*potential spoilers ahead\*\*\* but has anyone seen the new Jurassic World movie? The movie was pretty much awful/boring, but one bright side was it felt like this movie had major vegan/animal liberation themes. 

Like, not just the in using the name ""Dominion"" but the movie opens with three of the characters breaking into a breeding facility to rescue a baby dinosaur and the imagery really looked like it was pulled from a DxE documentary. It also felt like there were so many instances where the film actively tried to make viewers think about how humans view themselves as superior to other animals, and how our exercising of violence over them is rooted in this belief, and that it's not just cruel, but will ultimately lead to our own demise. 

There are like ten other examples in the movie that come to mind, all super subtle, so not sure if im reading into it/seeing my own beliefs reflected. idk, would love to hear others thoughts!"
vegan,I'm disgusted by everything and everyone now.,"Hello,  
I recently turned vegan. Three weeks ago, to be exact. I don't see animals as food anymore and I feel really fucking stupid for not having realized the horrors of the meat, dairy and milk (..etc.) industry sooner. I just discovered Earthling Ed on YouTube, watched one of his videos, then watched another ten and boom: I turned vegan overnight.  
Now my problem is that I feel disgusted by everything and everyone. I'm so glad my boyfriend went vegan right after me (he was being vegetarian his entire life before). But today I told some of my closest friends about having turned vegan and the first thing I got to hear was: ''Vegan? Veganism is a sickness. I get being vegetarian, but being vegan is clearly too much''. My other friends just relied on the chicken-nuggets-tho-argument.   
I'm also going to London in July to visit my grandma and during a facetime call I told her ''Hey I have to tell you something before you buy groceries for me and my boyfriend: we went vegan and we would very much like it if you didn't cook/buy anything non-vegan for us, we will take care of our food ourselves'' and she grabbed her head and said ''holy shit''.   
So my question is (or maybe it's just a late night rant): what do I do?  
I genuiely feel like never talking to my friends again, calling London off and just hiding in my room forever. I get it, I also used to say ''yeah I couldn't be vegan'', but I never claimed that veganism is a sickness. In fact, I always respected my boyfriend for being vegetarian and vegan people for being who they are and what impact they have. Hearing such a thing from one of my closest friends really broke my heart. I tried to counter every of their arguments properly and with facts (even offered them a source) but they would just decline and say stuff like ''I just don't like vegetables, that's all''.

Rant over, I think."
vegan,is this claim about beef production and deforestation true?,"i’m looking for figures on how many trees are cut down per pound of beef. the only prominent claim that i’m seeing is:

‘to produce 1 pound of beef, it takes approximately 55 square feet of rainforest, which is anywhere between 45 to 55 trees’

is this true? it just seems unbelievable to me. i know beef production is the leading cause of deforestation, though, so potentially it is? but as far as i can see, there aren’t any sources cited, and  all the claims are coming from vegan websites. 

vegan btw"
vegan,Which nation do you think will become the first vegan nation?,"If you don't think any of these countries will be the first, then comment below on which one you think.

[View Poll](https://www.reddit.com/poll/v9igxo)"
